{
  "format_version": "gameplay-config-format-v1",
  "document_kind": "presentation-catalog",
  "package_id": "personal-world-combat-v1",
  "qualification_state": "production",
  "resources": [
    { "id": "personal-world-combat/resource/player-display", "kind": "display", "logical_key": "actor.player.display" },
    { "id": "personal-world-combat/resource/monster-display", "kind": "display", "logical_key": "actor.monster.display" },
    { "id": "personal-world-combat/resource/boss-display", "kind": "display", "logical_key": "actor.boss.display" },
    { "id": "personal-world-combat/resource/sword-display", "kind": "display", "logical_key": "weapon.sword.display" },
    { "id": "personal-world-combat/resource/fan-display", "kind": "display", "logical_key": "weapon.fan.display" },
    { "id": "personal-world-combat/resource/fan-projectile-display", "kind": "display", "logical_key": "projectile.fan.display" },
    { "id": "personal-world-combat/resource/sword-animation", "kind": "animator", "logical_key": "ability.sword.primary" },
    { "id": "personal-world-combat/resource/fan-animation", "kind": "animator", "logical_key": "ability.fan.primary" },
    { "id": "personal-world-combat/resource/monster-animation", "kind": "animator", "logical_key": "ability.monster.strike" },
    { "id": "personal-world-combat/resource/boss-animation", "kind": "animator", "logical_key": "ability.boss.slam" },
    { "id": "personal-world-combat/resource/damage-vfx", "kind": "vfx", "logical_key": "effect.damage.vfx" },
    { "id": "personal-world-combat/resource/combat-audio", "kind": "audio", "logical_key": "cue.combat.audio" },
    { "id": "personal-world-combat/resource/state-hud", "kind": "hud", "logical_key": "actor.state.hud" },
    { "id": "personal-world-combat/resource/boss-hud", "kind": "hud", "logical_key": "boss.state.hud" },
    { "id": "personal-world-combat/resource/melee-camera", "kind": "camera", "logical_key": "camera.melee.intent" },
    { "id": "personal-world-combat/resource/ranged-camera", "kind": "camera", "logical_key": "camera.ranged.intent" }
  ],
  "mappings": [
    { "semantic_id": "personal-world-combat/actor/player", "semantic_kind": "actor", "resource_refs": ["personal-world-combat/resource/player-display", "personal-world-combat/resource/state-hud"] },
    { "semantic_id": "personal-world-combat/actor/ordinary-monster", "semantic_kind": "actor", "resource_refs": ["personal-world-combat/resource/monster-display", "personal-world-combat/resource/state-hud"] },
    { "semantic_id": "personal-world-combat/actor/boss", "semantic_kind": "actor", "resource_refs": ["personal-world-combat/resource/boss-display", "personal-world-combat/resource/boss-hud"] },
    { "semantic_id": "personal-world-combat/weapon/sword", "semantic_kind": "weapon", "resource_refs": ["personal-world-combat/resource/sword-display", "personal-world-combat/resource/melee-camera"] },
    { "semantic_id": "personal-world-combat/weapon/fan", "semantic_kind": "weapon", "resource_refs": ["personal-world-combat/resource/fan-display", "personal-world-combat/resource/ranged-camera"] },
    { "semantic_id": "personal-world-combat/ability/sword-primary", "semantic_kind": "ability", "resource_refs": ["personal-world-combat/resource/sword-animation"] },
    { "semantic_id": "personal-world-combat/ability/fan-primary", "semantic_kind": "ability", "resource_refs": ["personal-world-combat/resource/fan-animation"] },
    { "semantic_id": "personal-world-combat/ability/monster-strike", "semantic_kind": "ability", "resource_refs": ["personal-world-combat/resource/monster-animation"] },
    { "semantic_id": "personal-world-combat/ability/boss-slam", "semantic_kind": "ability", "resource_refs": ["personal-world-combat/resource/boss-animation"] },
    { "semantic_id": "personal-world-combat/projectile/fan-blade", "semantic_kind": "projectile", "resource_refs": ["personal-world-combat/resource/fan-projectile-display"] },
    { "semantic_id": "personal-world-combat/effect/sword-damage", "semantic_kind": "effect", "resource_refs": ["personal-world-combat/resource/damage-vfx"] },
    { "semantic_id": "personal-world-combat/effect/fan-damage", "semantic_kind": "effect", "resource_refs": ["personal-world-combat/resource/damage-vfx"] },
    { "semantic_id": "personal-world-combat/effect/monster-damage", "semantic_kind": "effect", "resource_refs": ["personal-world-combat/resource/damage-vfx"] },
    { "semantic_id": "personal-world-combat/effect/boss-damage", "semantic_kind": "effect", "resource_refs": ["personal-world-combat/resource/damage-vfx"] },
    { "semantic_id": "personal-world-combat/cue/player-state", "semantic_kind": "cue", "resource_refs": ["personal-world-combat/resource/combat-audio"] },
    { "semantic_id": "personal-world-combat/cue/ordinary-monster-state", "semantic_kind": "cue", "resource_refs": ["personal-world-combat/resource/combat-audio"] },
    { "semantic_id": "personal-world-combat/cue/boss-state", "semantic_kind": "cue", "resource_refs": ["personal-world-combat/resource/combat-audio"] },
    { "semantic_id": "personal-world-combat/cue/sword-equipped", "semantic_kind": "cue", "resource_refs": ["personal-world-combat/resource/combat-audio"] },
    { "semantic_id": "personal-world-combat/cue/fan-equipped", "semantic_kind": "cue", "resource_refs": ["personal-world-combat/resource/combat-audio"] },
    { "semantic_id": "personal-world-combat/cue/sword-primary", "semantic_kind": "cue", "resource_refs": ["personal-world-combat/resource/combat-audio"] },
    { "semantic_id": "personal-world-combat/cue/fan-primary", "semantic_kind": "cue", "resource_refs": ["personal-world-combat/resource/combat-audio"] },
    { "semantic_id": "personal-world-combat/cue/fan-projectile", "semantic_kind": "cue", "resource_refs": ["personal-world-combat/resource/combat-audio"] },
    { "semantic_id": "personal-world-combat/cue/sword-hit", "semantic_kind": "cue", "resource_refs": ["personal-world-combat/resource/combat-audio"] },
    { "semantic_id": "personal-world-combat/cue/fan-hit", "semantic_kind": "cue", "resource_refs": ["personal-world-combat/resource/combat-audio"] },
    { "semantic_id": "personal-world-combat/cue/monster-strike", "semantic_kind": "cue", "resource_refs": ["personal-world-combat/resource/combat-audio"] },
    { "semantic_id": "personal-world-combat/cue/monster-hit", "semantic_kind": "cue", "resource_refs": ["personal-world-combat/resource/combat-audio"] },
    { "semantic_id": "personal-world-combat/cue/boss-slam", "semantic_kind": "cue", "resource_refs": ["personal-world-combat/resource/combat-audio"] },
    { "semantic_id": "personal-world-combat/cue/boss-hit", "semantic_kind": "cue", "resource_refs": ["personal-world-combat/resource/combat-audio"] },
    { "semantic_id": "personal-world-combat/cue/boss-enraged", "semantic_kind": "cue", "resource_refs": ["personal-world-combat/resource/combat-audio"] },
    { "semantic_id": "personal-world-combat/cue/boss-desperate", "semantic_kind": "cue", "resource_refs": ["personal-world-combat/resource/combat-audio"] }
  ]
}
